{
  "$schema": "fixture.schema.json",
  "name": "Chinese Moving Wash",
  "type": "LED",
  "channels": [
    {
      "name": "Red",
      "dmx": 1,
      "min": 0,
      "max": 255
    },
    {
      "name": "Green",
      "dmx": 2,
      "min": 0,
      "max": 255
    },
    {
      "name": "Blue",
      "dmx": 3,
      "min": 0,
      "max": 255
    },
    {
      "name": "Strobe",
      "dmx": 4,
      "min": 0,
      "max": 255
    },
    {
      "name": "Apeshit",
      "dmx": 5,
      "min": 0,
      "max": 255
    },
    {
      "name": "Chase",
      "dmx": 6,
      "min": 0,
      "max": 255
    },
    {
      "name": "Program",
      "dmx": 7,
      "min": 0,
      "max": 255
    }
  ],
  "movements": [
    {
      "name": "Pan",
      "min": -270,
      "max": 270
    },
    {
      "name": "Tilt",
      "min": -135,
      "max": 135
    }
  ]
}
