{
  "name": "Martin Mac 101",
  "type": "LED",
  "channels": [
    {
      "name": "Strobe",
      "dmx": 1,
      "min": 85,
      "max": 70
    },
    {
      "name": "Master",
      "dmx": 2,
      "min": 0,
      "max": 255
    },
    {
      "name": "PanCoarse",
      "dmx": 3,
      "min": 0,
      "max": 255
    },
    {
      "name": "PanFine",
      "dmx": 4,
      "min": 0,
      "max": 255
    },
    {
      "name": "TiltCoarse",
      "dmx": 5,
      "min": 0,
      "max": 255
    },
    {
      "name": "TiltFine",
      "dmx": 6,
      "min": 0,
      "max": 255
    },
    {
      "name": "FixtureControls",
      "dmx": 7,
      "min": 0,
      "max": 255
    },
    {
      "name": "ColorWheel",
      "dmx": 8,
      "min": 0,
      "max": 255
    },
    {
      "name": "Red",
      "dmx": 9,
      "min": 0,
      "max": 255
    },
    {
      "name": "Green",
      "dmx": 10,
      "min": 0,
      "max": 255
    },
    {
      "name": "Blue",
      "dmx": 11,
      "min": 0,
      "max": 255
    },
    {
      "name": "Color Temperature",
      "dmx": 12,
      "min": 0,
      "max": 255
    }
  ],
  "movements": [
    {
      "name": "Pan",
      "min": -270,
      "max": 270
    },
    {
      "name": "Tilt",
      "min": -120,
      "max": 120
    }
  ]
}